"ccaa","provincia","carretera","carretera_small","salida_carretera","sentido_carretera","tipo_sentido_carretera (si ese sentido aumenta km, ascendente; si no, descendente; pongo 'ambas' cuando está dentro de un pueblo y se puede acceder fácilmente desde ambos sentidos)","pet_friendly","terraza","nombre","descripcion","web","teléfono","coordenada_y","coordenada_x","google_maps","image1",,"otras_observaciones"
"Andalucía","Cádiz","Colonia de Caulina, C. 11 AP-4. Entrada Autopista Sevilla , en Jerez de la Frontera","AP-4","78 (salida)","sevilla_hacia_cadiz","¿ascendente?","No","Sí","Venta Esteban","Huevos revueltos, entremeses y raciones, así como guisos jerezanos.","www.restauranteventaesteban.es",956316067,"36.7022226","-6.0851261","https://www.google.es/maps/place/Venta+Esteban/@36.7022226,-6.0851261,19.14z/data=!4m6!3m5!1s0xd0dc0b5565b6b11:0x17712a4556436a3c!8m2!3d36.7021428!4d-6.0853311!16s%2Fg%2F1vjdr9r7",,,
"Andalucía","Cádiz","Ctra. A-396 KM. 7,700 11150, La Barca de Vejer, Vejer de la Frontera","N-340 (E-5)","36 (km; en N-340) y 7,7 (km; en A-396)","cadiz_hacia_tarifa/malaga","¿ascendente?","Sí","Sí","Venta Pinto","En la antigua Posada de la Barca del siglo XVII, transformada en la Venta Pinto en 1910, hay que pedir el bocadillo de lomo en manteca en su barra y la ensaladilla. También cuentan con una carta para comer sentado en los salones o su terraza. ","https://www.ventapinto.com/",956450877,"36.2534753","-5.9567391","https://www.google.es/maps/place/Venta+Pinto/@36.2534753,-5.9567391,444m/data=!3m1!1e3!4m6!3m5!1s0xd0c45b123ecc7bb:0xa90248852900102a!8m2!3d36.2534549!4d-5.9568065!16s%2Fg%2F12qfxt1hn",,,"De Cádiz hacia Málaga, por la N-340, se incrementan los km"
"Andalucía","Huelva","Calle Alcázar y Pérez, 1 La Palma del Condado","A-49","48 (salida)","sevilla_hacia_huelva","¿ascendente?","Sí","Sí","Taberna Chocaito","Lleva más de medio siglo especializado en marisco, pescados y carne a la brasa.","https://www.tabernachocaito.com/",959401404,"37.3822635","-6.5528428","https://www.google.es/maps/place/Taberna+Chocaito/@37.3822635,-6.5528428,18.56z/data=!4m6!3m5!1s0xd11f22347d85f8b:0x535822eef7ba6a65!8m2!3d37.3821112!4d-6.5528711!16s%2Fg%2F11b6d9g9b1",,,
"Andalucía","Jaén","Ubicado en la puerta de Andalucía, en el Parque Natural de Despeñaperros, junto a la A-4, en el kilómetro 258, en Santa Elena","A-4","257 (salida)","jaen_hacia_madrid","¿descendente?","Sí","Sí","Mesón Despeñaperros","Cuenta con hotel, y un comedor con vistas a la naturaleza. Entre sus platos clásicos, lomo de orza, canelón de jabalí, albóndigas de ciervo, puerro a la leña con romesco o hamburguesa de corzo. Disponen de menú infantil.","https://www.xn--elmesondespeaperros-63b.es/restaurante/",953664100,"38.3439679","-3.5368468","https://www.google.es/maps/place/Restaurante+El+Mes%C3%B3n+Despe%C3%B1aperros/@38.3439679,-3.5368468,18.79z/data=!4m9!3m8!1s0xd6ebc7dc310cff7:0x40b90c1744ff38b7!5m2!4m1!1i2!8m2!3d38.343923!4d-3.536801!16s%2Fg%2F1tj7gdjk",,,
"Andalucía","Málaga","A un paso de la A-45, en la salida hacia Alameda","A-45","86 (salida)","cordoba_hacia_malaga","¿ascendente?","Sí","Sí","Caserío San Benito","Liderada por Esperanza Muñoz de León. Hay que pedir porra antequerana, migas o cualquiera de sus arroces caldosos y platos de cuchara. Las judías pintas con pato son pura maravilla.","https://www.caseriodesanbenito.com/",952111103,"37.1680242","-4.5554814","https://www.google.es/maps/place/Restaurante+Caser%C3%ADo+de+San+Benito/@37.1680242,-4.5554814,18.31z/data=!4m6!3m5!1s0xd729800d05b4965:0x22eb0db57511eca9!8m2!3d37.1682359!4d-4.5554366!16s%2Fg%2F1tdp1tw1",,,
"Andalucía","Málaga","En la A-7 Autovía del Mediterráneo, km 201, La Cala de Mijas","A-7","201 (km)","cadiz_hacia_malaga","¿descendente?","Sí","Sí","La Butibamba","Sus platos de lomos con patatas son clásicos. Hay cuchareo y raciones varias. No es un delicatessen, pero sí un lugar a precios populares estupendo para una parada. También para desayunar.","https://www.ventabutibamba.com/",952492133,"36.5015452","-4.6850089","https://www.google.es/maps/place/Venta+Restaurante+La+Butibamba/@36.5015452,-4.6850089,18.99z/data=!4m6!3m5!1s0xd731e291c0daa61:0xb669920ad764b6d8!8m2!3d36.5016937!4d-4.6847124!16s%2Fg%2F1tpf8g_h",,,
"Andalucía","Málaga","También a un paso de la A-7","A-7","200 (km)","cadiz_hacia_malaga","¿descendente?","Sí","Sí","Florida Beach Mijas","Es un sitio algo más reposado, justo frente al mar y con una carta algo más selecta. Los arroces son estupendos, como la berenjena frita con miel de Ronda o sus pescados. Aunque no suele estar ahí, su cocina está dirigida por Iván Cerdeño. Para una parada un poquito más larga, quizá. ","https://floridabeach.es/palmera-restaurant/",951068807,"36.4936817","-4.6913402","https://www.google.es/maps/place/Florida+Mijas+Beach/@36.4936817,-4.6913402,19.86z/data=!4m6!3m5!1s0xd731f45970409cd:0xf393a606e596c990!8m2!3d36.4937996!4d-4.6911232!16s%2Fg%2F11j0wz47rd",,,
"Andalucía","Sevilla","Poligono Industrial La Campiña, C. Asturias, 2, Écija","A-4","457 (salida)","cordoba_hacia_sevilla","¿ascendente?",,,"Mesón La Campiña","Restaurante dentro de un polígiono para tomar un bocadillo, raciones o guisos.","http://www.mesonlacampina.com/",691418430,"37.530196","-5.1245611","https://www.google.es/maps/place/Meson+La+Campi%C3%B1a/@37.530196,-5.1245611,512m/data=!3m1!1e3!4m6!3m5!1s0xd12ca0afbc772db:0x5616a3e7ad31ddb0!8m2!3d37.5300083!4d-5.1244749!16s%2Fg%2F1thnq0qb",,,
"Aragón","Zaragoza","En la Autovía A-2, con locales en los dos sentidos de la carretera (en el kilómetro 281,6, sentido Madrid, y en el 280, sentido Zaragoza)","A-2","280 (salida desde Madrid) y 281 (salida desde Zaragoza)","madrid_hacia_zaragoza","¿ascendente?","Sí","Sí","Área 280","Ofrece un surtido de bocadillos, entre ellos el de pierna de ternasco encebollado o de longaniza con queso semicurado y alioli, platos combinados, además de un menú diario y de un menú infantil, con platos como pechugas de pollo empanadas, huevo frito, patatas fritas, helado y refresco.","https://area280restaurantes.es",678053742,"41.5164007","-1.2887863","https://www.google.es/maps/place/Restaurante+%C3%81rea+280+Zaragoza+(Los+Olivos)/@41.5164007,-1.2887863,357m/data=!3m1!1e3!4m6!3m5!1s0xd5be15424013503:0x69f22cf2f5dea99d!8m2!3d41.5163251!4d-1.2880229!16s%2Fg%2F11f3nb3pb7",,,
"Asturias","Asturias","En la A-66 Asturias, en Pola de Lena","A-66","59 (salida)","oviedo_hacia_zamora","¿descendente?","No","Sí","Mo. El Bar de Monte","Es el bar de Monte, el restaurante de Xune Andrade, con una estrella Michelin en San Feliz. Ofrece conservas, chacinas de la carnicería de la familia del cocinero, croquetas de Monte, quesos asturianos y carnes.","https://www.montesanfeliz.com/",985075213,"43.1586399","-5.8292459","https://www.google.es/maps/place/MO.+El+bar+de+Monte/@43.1586399,-5.8292459,568m/data=!3m1!1e3!4m6!3m5!1s0xd36fb413c74475d:0x4653f4ecf8e98a5!8m2!3d43.1585772!4d-5.829065!16s%2Fg%2F11r_mk41vh",,,
"Asturias","Asturias","En la carretera Nacional 634. Km 511, 150,  Otur (Luarca)","N-634 (E-70)","511 (km)","asturias_hacia_galicia","¿descendente?","No","No","Casa Consuelo","Se trata de una venta familiar que desde 1935 da de comer a buena parte del que pasa por el Occidente asturiano. Ofrece una comida casera, en la que destacan, la fabada y el salpicón de marisco.","https://www.casaconsuelo.es/",985641696,"43.5400593","-6.5939908","https://www.google.es/maps/place/Restaurante+Casa+Consuelo/@43.5400593,-6.5939908,365m/data=!3m1!1e3!4m6!3m5!1s0xd3159e794af7d37:0xf046db6598a79e5c!8m2!3d43.5400619!4d-6.5938711!16s%2Fg%2F12qhdhqvd",,,
"Baleares","Mallorca","Ma-13A, km 14, 5, Santa Maria del Camí","Ma-13","8 (salida hacia Ma-13A)","palma_hacia_inca","¿descendente?","Sí","Sí","Es Racó d'en Jaume","Esta especializado en platos de carne, en arroces y pescados. Dispone de terrazas, grill y piscina exterior. ","https://www.esracodenjaume.com/",971141266,"39.647894","2.7593577","https://www.google.es/maps/place/Es+Rac%C3%B3+d'en+Jaume/@39.647894,2.7593577,18.34z/data=!4m6!3m5!1s0x1297ea92fcbc8e5f:0x748b78f91f57864b!8m2!3d39.6475677!4d2.7602322!16s%2Fg%2F1hhlnclfb",,,
"Canarias","Las Palmas","En la carretera del Norte, 50. Arucas","GC-2","12 (km; la altura de Arucas)","las-palmas_hacia_el-pagador","¿ascendente?","Sí","Sí","La casa del Duende","Comida casera donde sirven desayunos, almuerzos y cenas.",,928943793,"28.1453453","-15.5560923","https://www.google.es/maps/place/La+casa+del+Duende/@28.1453453,-15.5560923,19.04z/data=!4m6!3m5!1s0xc4092d31cb1ab7b:0x827863e533c249f4!8m2!3d28.145397!4d-15.555772!16s%2Fg%2F11crvvj567",,,
"Canarias","Las Palmas","En carretera del Norte, kilómetro 13.","GC-2","13 (km; a la altura de Moya)","las-palmas_hacia_el-pagador","¿ascendente?",,,"Pepe Chiringo San Andrés","Restaurante donde tomar sandwiches, hamburguesas, ensaladas y bocadillos de lomo de pechuga.","https://pepechiringo.es/",928830713,"28.1457482","-15.5606566","https://www.google.es/maps/place/Pepe+Chiringo+San+andres/@28.1457482,-15.5606566,18.75z/data=!4m6!3m5!1s0xc4092cd6a80eacb:0x82126a31ad346c3e!8m2!3d28.1455808!4d-15.5604398!16s%2Fg%2F11bxfjcv83",,,
"Canarias","Tenerife","En el cruce de Las Eras, en la autopista del Sur, en el Barranco Hondo (Tenerife)","TF-1","35 (salida)","los-cristianos_hacia_santa-cruz","¿ascendente?",,,"Autobar de Julián","Se les llama las borrachas a los autobares, los food trucks o las gastro furgonetas que aquí se encuentran. Además de los bocadillos de cochino, un refresco y un café, cuenta con vistas al mar.  ","https://www.facebook.com/profile.php?id=100057456848501","(No tiene)","28.2020041","-16.4267954","https://www.google.es/maps/place/Autobar+Juli%C3%A1n/@28.2020041,-16.4267954,19.34z/data=!4m6!3m5!1s0xc4025c29239e6bb:0x522505a1806ee431!8m2!3d28.2018665!4d-16.4267368!16s%2Fg%2F11hck28p_5",,,
"Cantabria","Cantabria","Próximo a la A-8, en Solares","A-8","197 (salida hacia N-634)","torrelavega_hacia_bilbao","¿descendente?","Sí","Sí","Hotel Casa Enrique","Tiene platos de puchero, jamón, cecina, ensaladillas y pescados del Cantábrico.","https://restaurantecasaenrique.es/",942520073,"43.387188","-3.731122","https://www.google.es/maps/place/Restaurante+Casa+Enrique/@43.387188,-3.731122,19.14z/data=!4m9!3m8!1s0xd4ecad980f58db5:0xeedbac4c01d2143!5m2!4m1!1i2!8m2!3d43.3871275!4d-3.7310661!16s%2Fg%2F1wd3xc77",,,
"Castilla y León","Ávila","Km 111 A-6, Adanero, Ávila","A-6","112 (salida)","madrid_hacia_galicia","¿ascendente?","No","Sí","Restaurante MA","Tienen tapas de tres euros como el bocadillo de papada ibérica curada, huevo, foie y caviar de mujol o de nueve euros, de seis euros como el steak tartar de vaca rubia gallega, huevo y patatas fritas, y bocadillos de autor como el de lomo de cerdo, pimientos verdes, cebolla morada, queso brie y mahonesa de jalapeños por 9 euros.","https://restaurantema.com/",920307050,"40.9567744","-4.6148832","https://www.google.es/maps/place/Restaurante+MA/@40.9567744,-4.6148832,530m/data=!3m1!1e3!4m6!3m5!1s0xd40c47010112d51:0x2fccfbb31c118a76!8m2!3d40.9566078!4d-4.6147437!16s%2Fg%2F11b635dj00",,,
"Castilla y León","Burgos","En el kilómetro 235 de la Carretera Madrid-Irún, a la altura de Burgos","A-1","235 (salida)","burgos_hacia_madrid","¿descendente?","Sí","Sí","Hotel Landa","Este emblemático hotel, de torreón del siglo XI, templete del siglo XIX de estilo modernista, decoración de ambiente medieval y perfumados aseos (venden la fragancia ambientadora), es parada de aquellos viajeros con destino al Norte. Su bar, con el personal uniformado a la antigua usanza, siempre está a rebosar de gente a cualquier hora del día, en busca de su plato más solicitado, los huevos con morcilla, así como la repostería que elaboran ellos mismos. El hotel cuenta con un agradable parking rodeado de verde, restaurante y una tienda en la que se pueden adquirir desde las morcillas, una bolsa de lino con la firma de la casa o un atillo de rosquillas.","https://www.landa.as/es/",947257777,"42.3119337","-3.7031216","https://www.google.es/maps/place/Restaurante+Landa/@42.3119337,-3.7031216,478m/data=!3m1!1e3!4m6!3m5!1s0xd45e3e85110ba97:0xbe44945e7541e8a6!8m2!3d42.3117874!4d-3.7034681!16s%2Fg%2F11r_y73nk3",,,
"Castilla y León","Burgos","En la Autovía N-1, salida Km 146, en Milagros, a 15 kilómetros de Aranda de Duero (Burgos)","A-1","146 (salida)","madrid_hacia_burgos","¿ascendente?","Sí","Sí","El Lagar de Milagros","Parada de muchos rockeros y grupos musicales en sus giras hacia el Norte de España, ofrece bocadillos con pan de pueblo de tortilla, jamón o pepito de ternera. Platos combinados a base de chuletillas de lechazo, morcilla de Aranda y ensalada o patatas fritas, de escalope de ternera, tortilla de patatas, lechuga y tomate o de lomo adobado, morcilla, pimiento verde frito, ensalada o patatas fritas.","https://www.lagardemilagros.com",947548091,"41.5738285","-3.7042872","https://www.google.es/maps/place/Restaurante+EL+LAGAR+DE+MILAGROS/@41.5738285,-3.7042872,483m/data=!3m1!1e3!4m6!3m5!1s0xd4426c460f00fb7:0x934d15ed9ffb3f66!8m2!3d41.5736245!4d-3.7043518!16s%2Fg%2F1tm2b_5x",,,
"Castilla y León","León","Ctra. Asturias, 6, 24690 Busdongo de Arbás","N-630","92 (km; Altura municipio 'Busdongo de Arbás')","leon_hacia_oviedo","¿descendente?","Sí","Sí","Casa Maragato","Negocio familiar de finales del XIX con tienda, bar de embutidos donde sirven cecina recién cortada y un curioso museo de arena de playas de todo el mundo","https://www.facebook.com/people/Casa-Maragato/100059080964472",987598127,"42.9843896","-5.7056368","https://www.google.es/maps/place/Vinos+y+Licores+Casa+Maragato/@42.9843896,-5.7056368,289m/data=!3m1!1e3!4m6!3m5!1s0xd37aa5cd21c8d77:0x256c1c02085e5aac!8m2!3d42.9846239!4d-5.705666!16s%2Fg%2F1tz970rq",,,
"Castilla y León","Palencia","En la N611, en Alar de Rey ","N-611","(Km. 90 - Salida 'Alar de Rey')","palencia_hacia_santander","¿ascendente?","Sí","Sí","La Cueva","Parada para probar buena cocina casera, croquetas o bocadillos.","https://www.facebook.com/lacueva.alardelrey/?locale=es_ES",979133066,"42.6623624","-4.3135293","https://www.google.es/maps/place/La+Cueva+Restaurante/@42.6623624,-4.3135293,538m/data=!3m1!1e3!4m6!3m5!1s0xd488f2f2afffffb:0x5c43ac8d3c65dd0f!8m2!3d42.6623131!4d-4.3134327!16s%2Fg%2F1tdchpfd",,,
"Castilla y León","Salamanca","C. Azucena, 4, 37500 Ivanrey, Salamanca (junto a la N-620)","A-62","325 (salida)","salamanca_hacia_portugal","¿ascendente?","Sí","Sí","Hermanos Moreno","La especilidad es el pollo a la parrilla.","(No tiene)",923461620,"40.6074359","-6.5594853","https://www.google.es/maps/place/Restaurante+Hermanos+Moreno/@40.6074359,-6.5594853,427m/data=!3m1!1e3!4m6!3m5!1s0xd3c2ff4f4d4de63:0xf5b0cf339174db35!8m2!3d40.6073749!4d-6.5594075!16s%2Fg%2F1tmpg6tc",,,
"Castilla y León","Segovia","Autovía A-1, km 115, en Boceguillas","A-1","115 (salida)","madrid_hacia_burgos","¿ascendente?","Sí","Sí","Área Boceguillas","Con una estética rústica cuidada con mimo en los detalles, la parada no defrauda si lo que se busca son ricos bizcochos, emparedados con pan de aceite con rellenos elaborados en la casa. Dispone de un restaurante si lo que se desea es hacer una comida más copiosa con guisos y asados.Tiene una pequeña tienda en la que venden labores artesanas como manteles, paños y cojines hasta vajillas y cristalería y productos gourmet de la zona.","http://www.areaboceguillas.com/",921543703,"41.3237865","-3.6317492","https://www.google.es/maps/place/Restaurante+%C3%81rea+de+Boceguillas/@41.3237865,-3.6317492,799m/data=!3m1!1e3!4m6!3m5!1s0xd4405c0e5f89fbf:0xcc8461ac936419d!8m2!3d41.3237256!4d-3.6316369!16s%2Fg%2F1tfryssp",,,
"Castilla y León","Soria","En la A-2, en el kilómetro 145, o en la Nacional 111, en Medinaceli ","A-2","145 (salida; dirección Zaragoza) - 151 (salida; dirección Madrid)","zaragoza_hacia_madrid","¿ambas?","No","Sí","Carlos Mary","Desde 1966, este negocio familiar abre desde bien temprano para servir desayunos, hasta un almuerzo, merienda o cenas. Una buena excusa para probar los torreznos de Soria, el cochinito frito o las judías asadas. Comica casera con menú del día.","https://www.restaurantecarlosmary.es",975326014,"41.1647015","-2.4229447","https://www.google.es/maps/place/Restaurante+Carlos+Mary/@41.1647015,-2.4229447,504m/data=!3m1!1e3!4m6!3m5!1s0xd5cac887aee602b:0xf5b3da6f78df3e04!8m2!3d41.1645295!4d-2.4228196!16s%2Fg%2F1ptzdmfb9",,,
"Castilla y León","Valladolid","En la A-6, calle Santísimo Cristo, 128, 47490 Rueda, Valladolid ","A-6","170 (salida)","madrid_hacia_leon","¿ascendente?","Sí","Sí","Casa Lola","Bar-tienda con productos gourmet, desde embutidos, quesos, vinos y dulces, es desde 1990 uno de los puntos más concurridos por los viajeros de esta ruta. Tiene un amplio surtido de bocadillos, entre ellos, de jamón y chorizo Joselito, tostas, conservas y raciones para compartir.","https://www.ruedacasalola.com/es",983868023,"41.4074642","-4.960697","https://www.google.es/maps/place/Casa+Lola/@41.4074642,-4.960697,491m/data=!3m1!1e3!4m9!3m8!1s0xd475bf3cbb78475:0xd5ba6e18b8876696!5m2!4m1!1i2!8m2!3d41.4072753!4d-4.9602169!16s%2Fg%2F1tgjmltt",,,
"Castilla y León","Valladolid","En la A-6, km. 170,6 en Rueda","A-6","170 (salida)","madrid_hacia_leon/galicia","¿ascendente?","Sí","Sí","Palacio de Bornos","El bar y la tienda de la bodega se han convertido en una parada de picoteo, especialmente de la pulga de jamón por 3,30 euros, y compra de vino.","https://www.palaciodebornos.com/",983868276,"41.4047539","-4.9603794","https://www.google.es/maps/place/Palacio+de+Bornos/@41.4047539,-4.9603794,564m/data=!3m1!1e3!4m6!3m5!1s0xd475be86367b19f:0xf35338b16230de63!8m2!3d41.4047871!4d-4.9595035!16s%2Fg%2F11f781z7gv",,,
"Castilla y León","Zamora","En la A-6, Arrabal Huerta de los Salados, 49600 Benavente","A-6","259 (salida)","madrid_hacia_leon/galicia","¿ascendente?","Sí","No","El Ermitaño","Tiene un mesón para una comida más informal a base de embutidos, quesos, encurtidos, patés y conservas, además de un restaurante en el que ofrecen platos, como garbanzos con callos de bacalao, cochinillo, tartar de trucha o cochinillo a la naranja. En su tienda despachan platos preparados, como el lechazo en su jugo, canutillos de cecina, albondigas de lechazo o crema de queso de cabra.","https://elermitano.com/",980632213,"42.0059369","-5.6574007","https://www.google.es/maps/place/El+Ermita%C3%B1o+Restaurante/@42.0059369,-5.6574007,723m/data=!3m1!1e3!4m6!3m5!1s0xd384c107d57f6e5:0xd649a4663400f889!8m2!3d42.0058258!4d-5.6566625!16s%2Fg%2F11bzt21j_8",,,
"Castilla-La Mancha","Albacete","En dirección a Alicante (A-3), en Roda","A-31 (entrando en La Roda; carretera N-301)","Salidas de La Roda","atalaya_hacia_albacete_viceversa","¿ambas?","No","No","Confitería La Moderna","Parada obligatoria para tomar un café y sus famosos Miguelitos con crema pastelera.","https://confiterialamoderna.com/",967440235,"39.2059767","-2.1575802","https://www.google.es/maps/place/pasteler%C3%ADa+Confiter%C3%ADa+la+Moderna/@39.2059767,-2.1575802,529m/data=!3m1!1e3!4m6!3m5!1s0xd6636104b4992d3:0x6ef78efb472b8210!8m2!3d39.2056281!4d-2.1569442!16s%2Fg%2F1thvj8pg",,,
"Castilla-La Mancha","Albacete","En dirección a Alicante (A-3), en Roda","A-31 (entrando en La Roda; carretera N-301)","Salidas de La Roda","atalaya_hacia_albacete_viceversa","¿ambas?","Sí","Sí","Juanito","Ofrece quesos curados, lomo de orza, huevos estrellados y otras delicias.","https://hoteljuanito.com/",967548041,"39.2055646","-2.159635","https://www.google.es/maps/place/Hotel+Restaurante+Juanito/@39.2055646,-2.159635,454m/data=!3m1!1e3!4m9!3m8!1s0xd6636118d4fe0dd:0x24c173f7140df3a9!5m2!4m1!1i2!8m2!3d39.2056718!4d-2.159135!16s%2Fg%2F1tg9pgqz",,,
"Castilla-La Mancha","Cuenca","En la autovía del Este, Km.124, en Zafra de Záncara","A-3","124 (salida)","madrid_hacia_valencia","¿ascendente?","Sí","Sí","Venta San José","Desde 1980, este negocio familiar ofrece un repertorio de platos de la cocina manchega -potajes, guisos, pucheros, paletilla de lechal al horno o chuletón a la brasa de leña de encina carrasca-, así como un surtido de productos de la región, como 20 tipos diferentes de quesos manchegos. Elaboran menús, platos combinados, raciones o bocadillos.","www.restauranteventasanjose.com",969298458,"39.8660084","-2.5778056","https://www.google.es/maps/place/Venta+San+Jos%C3%A9/@39.8660084,-2.5778056,650m/data=!3m1!1e3!4m6!3m5!1s0xd68047c04a6db87:0xc3be45d17e52a130!8m2!3d39.8657358!4d-2.5776065!16s%2Fg%2F1hc4jkqt0",,,
"Castilla-La Mancha","Cuenca","Autovía del Este (A-3) Km. 175, Atalaya del Cañavate","A-3","175 (salida)","albacete_hacia_madrid","¿descendente?","Sí","Sí","Mesón Los Rosales","Entre su oferta destacan los escabeches, los quesos, los embutidos y las patatas con huevos y chorizo. Tienen tienda gourmet con mermeladas y miel de la zona.","https://es-es.facebook.com/MesonLosRosales/",969381447,"39.5362307","-2.2531447","https://www.google.es/maps/place/Restaurant+Meson+Los+Rosales/@39.5362307,-2.2531447,943m/data=!3m1!1e3!4m6!3m5!1s0xd67c46ff76d8425:0x2206255b25b2a12e!8m2!3d39.5363015!4d-2.2532058!16s%2Fg%2F11b5k78cq0",,,
"Castilla-La Mancha","Cuenca","A-3. km. 168. Honrubia","A-3","168 (salida)","madrid_hacia_valencia","¿ascendente?","Sí","Sí","Hotel Restaurante Marino","Con una gran variedad de platos, mención especial para las carnes a la brasa. Recomendable el pepito de ternera.","https://hotelmarino.com/",969292584,"39.5967229","-2.2801028","https://www.google.es/maps/place/Restaurant+Marino/@39.5967229,-2.2801028,609m/data=!3m1!1e3!4m6!3m5!1s0xd67c2e7aedbad7d:0x765cc37c32caba41!8m2!3d39.5962982!4d-2.2805356!16s%2Fg%2F11fx95_hvr",,,
"Castilla-La Mancha","Guadalajara","En la Autovía A-2, en el kilómetro 103, en Almadrones","A-2","103 (salida)","zaragoza_hacia_madrid","¿descendente?","Sí","Sí","Área 103","Es la historia de la familia Rebollo, que en 1889 se hizo cargo de la Venta de Almadrones, un negocio que es una dirección habitual entre los profesionales del camión. Disponen de una barra con un buen surtido de tapas, con croquetas caseras recién fritas y torreznos. Tienen un restaurante con asados y platos de cuchara, un huerto del que se nutren en verduras y hortalizas, y una tienda en la que venden los almadrones, unos dulces que elaboraba la abuela Nieves, o los productos que comercializan con la marca Acojonante (desde pochas, alcachofas, chocolates o rosquillas).","https://area103.es/",949285522,"40.8964275","-2.7621959","https://www.google.es/maps/place/%C3%81rea+103+Venta+de+Almadrones/@40.8964275,-2.7621959,472m/data=!3m2!1e3!5s0xd433fc647a8660f:0x6055580c1e8c7ddc!4m14!1m7!3m6!1s0xd433f3a22a02f67:0x65f6a5c7a7220fc2!2sArea+103!8m2!3d40.8978769!4d-2.7601832!16s%2Fg%2F11qp4x0b11!3m5!1s0xd433fc64a0b8053:0xee2476001b40330!8m2!3d40.8966977!4d-2.7613922!16s%2Fg%2F11b6hrnpww",,,
"Castilla-La Mancha","Toledo","Km 47 de la Autovía de Extremadura, A5. Casarrubios del Monte","A-5","47 (salida)","madrid_hacia_extremadura","¿ascendente?","Sí (en trasportín)","No","Las Esparteras","Barra tradicional para raciones y bocadillos y un comedor para asados. Cuentan con una tienda gourmet.","https://asadorlasesparteras.com/",918170932,"40.1837652","-4.1364631","https://www.google.es/maps/place/Restaurante+-+Asador+Las+Esparteras/@40.1837652,-4.1364631,743m/data=!3m1!1e3!4m6!3m5!1s0xd41c1234c35ec0d:0xdeeaecae2dadf5ac!8m2!3d40.1843505!4d-4.1353542!16s%2Fg%2F1v3kjtf2",,,
"Cataluña","Barcelona"," Ctra. C-16 Km 89 - La Rodonella - Cercs","C-16","105 (km)","barcelona_hacia_berga","¿ascendente?",,,"Els Portals de Cercs","Para parar a comer un bocadillo (tienen bastantes variedades de fríos y calientes) o comer, cocina catalana, carne a la brasa. Tienen una terraza con unas vistas muy bonitas del pantano de la Baells.","https://carta.menu/restaurants/cercs/els-portals",938248401,"42.1599425","1.8566112","https://www.google.es/maps/place/Els+Portals+de+Cercs/@42.1599425,1.8566112,691m/data=!3m1!1e3!4m6!3m5!1s0x12a50a38eedefde3:0x6ac861265274df02!8m2!3d42.1602919!4d1.8578643!16s%2Fg%2F11b88rv409",,,"No tiene web como tal. Mira si para los demás que no tienen web podemos utilizar también la web de Carta"
"Cataluña","Barcelona","Km. 562, Carretera Nacional II, Castellolí ","A-2","562 (salida)","lleida_hacia_barcelona","¿ascendente?","Sí","Sí","Nou Urbisol","Cocina catalana. Entre los platos destacan los buñuelos de bacalao, las cocas con foie y los huevos fritos con jamón.","https://www.nouurbisol.com/es",938084003,"41.5988301","1.6993805","https://www.google.es/maps/place/Restaurant+Nou+Urbisol/@41.5988301,1.6993805,737m/data=!3m1!1e3!4m6!3m5!1s0x12a45d6f4f973195:0x69de12e1acd1a728!8m2!3d41.5992187!4d1.7011267!16s%2Fg%2F11bwgwhgw1",,,
"Cataluña","Girona","En la C-31, Calle dels horts, 10, Viladamat ","C-31","(Altura municipio 'Viladamat'; cruza con carretera GI-623)","casteldefells_hacia_palafrugell","¿ambas?","No","No","Can Parera","Restaurante de comida casera con buenos arroces, tienen varios tipos, y carnes a la brasa. También hacen esmorzars de forquilla, es decir desayunos copioso de tenedor (callos, ternera con setas, galta de cerdo, pies de cerdo...)","https://www.restaurantcanparera.com/es/inicio/",972788367,"42.1345362","3.0759192","https://www.google.es/maps/place/Restaurant+Can+Parera/@42.1345362,3.0759192,558m/data=!3m1!1e3!4m6!3m5!1s0x12baf5c03c23d2bf:0x17769ddbeb04d15e!8m2!3d42.1347412!4d3.076861!16s%2Fg%2F1tsgyxs2",,,
